{
  "$schema": "../../../schemas/form-map.schema.json",
  "formatVersion": 1,
  "id": "dnd5e-2014-character-sheet",
  "name": "the 2014 fillable character sheet",
  "publisher": "Wizards of the Coast",
  "download": "https://www.dndbeyond.com/resources/1779-d-d-character-sheets",
  "system": "dnd5e",
  "kinds": [
    "pc"
  ],
  "encoding": "WinAnsi",
  "fields": {
    "ClassLevel": "text",
    "Background": "text",
    "PlayerName": "text",
    "CharacterName": "text",
    "Race ": "text",
    "Alignment": "text",
    "XP": "text",
    "Inspiration": "text",
    "STR": "text",
    "ProfBonus": "text",
    "AC": "text",
    "Initiative": "text",
    "Speed": "text",
    "PersonalityTraits ": "text",
    "STRmod": "text",
    "HPMax": "text",
    "ST Strength": "text",
    "DEX": "text",
    "HPCurrent": "text",
    "Ideals": "text",
    "DEXmod ": "text",
    "HPTemp": "text",
    "Bonds": "text",
    "CON": "text",
    "HDTotal": "text",
    "Check Box 12": "check",
    "Check Box 13": "check",
    "Check Box 14": "check",
    "CONmod": "text",
    "Check Box 15": "check",
    "Check Box 16": "check",
    "Check Box 17": "check",
    "HD": "text",
    "Flaws": "text",
    "INT": "text",
    "ST Dexterity": "text",
    "ST Constitution": "text",
    "ST Intelligence": "text",
    "ST Wisdom": "text",
    "ST Charisma": "text",
    "Acrobatics": "text",
    "Animal": "text",
    "Athletics": "text",
    "Deception ": "text",
    "History ": "text",
    "Insight": "text",
    "Intimidation": "text",
    "Check Box 11": "check",
    "Check Box 18": "check",
    "Check Box 19": "check",
    "Check Box 20": "check",
    "Check Box 21": "check",
    "Check Box 22": "check",
    "Wpn Name": "text",
    "Wpn1 AtkBonus": "text",
    "Wpn1 Damage": "text",
    "INTmod": "text",
    "Wpn Name 2": "text",
    "Wpn2 AtkBonus ": "text",
    "Wpn2 Damage ": "text",
    "Investigation ": "text",
    "WIS": "text",
    "Wpn Name 3": "text",
    "Wpn3 AtkBonus  ": "text",
    "Arcana": "text",
    "Wpn3 Damage ": "text",
    "Perception ": "text",
    "WISmod": "text",
    "CHA": "text",
    "Nature": "text",
    "Performance": "text",
    "Medicine": "text",
    "Religion": "text",
    "Stealth ": "text",
    "Check Box 23": "check",
    "Check Box 24": "check",
    "Check Box 25": "check",
    "Check Box 26": "check",
    "Check Box 27": "check",
    "Check Box 28": "check",
    "Check Box 29": "check",
    "Check Box 30": "check",
    "Check Box 31": "check",
    "Check Box 32": "check",
    "Check Box 33": "check",
    "Check Box 34": "check",
    "Check Box 35": "check",
    "Check Box 36": "check",
    "Check Box 37": "check",
    "Check Box 38": "check",
    "Check Box 39": "check",
    "Check Box 40": "check",
    "Persuasion": "text",
    "SleightofHand": "text",
    "CHamod": "text",
    "Survival": "text",
    "AttacksSpellcasting": "text",
    "Passive": "text",
    "CP": "text",
    "ProficienciesLang": "text",
    "SP": "text",
    "EP": "text",
    "GP": "text",
    "PP": "text",
    "Equipment": "text",
    "Features and Traits": "text",
    "CharacterName 2": "text",
    "Age": "text",
    "Height": "text",
    "Weight": "text",
    "Eyes": "text",
    "Skin": "text",
    "Hair": "text",
    "Faction Symbol Image": "button",
    "Allies": "text",
    "FactionName": "text",
    "Backstory": "text",
    "Feat+Traits": "text",
    "Treasure": "text",
    "CHARACTER IMAGE": "button",
    "Spellcasting Class 2": "text",
    "SpellcastingAbility 2": "text",
    "SpellSaveDC  2": "text",
    "SpellAtkBonus 2": "text",
    "SlotsTotal 19": "text",
    "SlotsRemaining 19": "text",
    "Spells 1014": "text",
    "Spells 1015": "text",
    "Spells 1016": "text",
    "Spells 1017": "text",
    "Spells 1018": "text",
    "Spells 1019": "text",
    "Spells 1020": "text",
    "Spells 1021": "text",
    "Spells 1022": "text",
    "Check Box 314": "check",
    "Check Box 3031": "check",
    "Check Box 3032": "check",
    "Check Box 3033": "check",
    "Check Box 3034": "check",
    "Check Box 3035": "check",
    "Check Box 3036": "check",
    "Check Box 3037": "check",
    "Check Box 3038": "check",
    "Check Box 3039": "check",
    "Check Box 3040": "check",
    "Check Box 321": "check",
    "Check Box 320": "check",
    "Check Box 3060": "check",
    "Check Box 3061": "check",
    "Check Box 3062": "check",
    "Check Box 3063": "check",
    "Check Box 3064": "check",
    "Check Box 3065": "check",
    "Check Box 3066": "check",
    "Check Box 315": "check",
    "Check Box 3041": "check",
    "Spells 1023": "text",
    "Check Box 251": "check",
    "Check Box 309": "check",
    "Check Box 3010": "check",
    "Check Box 3011": "check",
    "Check Box 3012": "check",
    "Check Box 3013": "check",
    "Check Box 3014": "check",
    "Check Box 3015": "check",
    "Check Box 3016": "check",
    "Check Box 3017": "check",
    "Check Box 3018": "check",
    "Check Box 3019": "check",
    "Spells 1024": "text",
    "Spells 1025": "text",
    "Spells 1026": "text",
    "Spells 1027": "text",
    "Spells 1028": "text",
    "Spells 1029": "text",
    "Spells 1030": "text",
    "Spells 1031": "text",
    "Spells 1032": "text",
    "Spells 1033": "text",
    "SlotsTotal 20": "text",
    "SlotsRemaining 20": "text",
    "Spells 1034": "text",
    "Spells 1035": "text",
    "Spells 1036": "text",
    "Spells 1037": "text",
    "Spells 1038": "text",
    "Spells 1039": "text",
    "Spells 1040": "text",
    "Spells 1041": "text",
    "Spells 1042": "text",
    "Spells 1043": "text",
    "Spells 1044": "text",
    "Spells 1045": "text",
    "Spells 1046": "text",
    "SlotsTotal 21": "text",
    "SlotsRemaining 21": "text",
    "Spells 1047": "text",
    "Spells 1048": "text",
    "Spells 1049": "text",
    "Spells 1050": "text",
    "Spells 1051": "text",
    "Spells 1052": "text",
    "Spells 1053": "text",
    "Spells 1054": "text",
    "Spells 1055": "text",
    "Spells 1056": "text",
    "Spells 1057": "text",
    "Spells 1058": "text",
    "Spells 1059": "text",
    "SlotsTotal 22": "text",
    "SlotsRemaining 22": "text",
    "Spells 1060": "text",
    "Spells 1061": "text",
    "Spells 1062": "text",
    "Spells 1063": "text",
    "Spells 1064": "text",
    "Check Box 323": "check",
    "Check Box 322": "check",
    "Check Box 3067": "check",
    "Check Box 3068": "check",
    "Check Box 3069": "check",
    "Check Box 3070": "check",
    "Check Box 3071": "check",
    "Check Box 3072": "check",
    "Check Box 3073": "check",
    "Spells 1065": "text",
    "Spells 1066": "text",
    "Spells 1067": "text",
    "Spells 1068": "text",
    "Spells 1069": "text",
    "Spells 1070": "text",
    "Spells 1071": "text",
    "Check Box 317": "check",
    "Spells 1072": "text",
    "SlotsTotal 23": "text",
    "SlotsRemaining 23": "text",
    "Spells 1073": "text",
    "Spells 1074": "text",
    "Spells 1075": "text",
    "Spells 1076": "text",
    "Spells 1077": "text",
    "Spells 1078": "text",
    "Spells 1079": "text",
    "Spells 1080": "text",
    "Spells 1081": "text",
    "SlotsTotal 24": "text",
    "SlotsRemaining 24": "text",
    "Spells 1082": "text",
    "Spells 1083": "text",
    "Spells 1084": "text",
    "Spells 1085": "text",
    "Spells 1086": "text",
    "Spells 1087": "text",
    "Spells 1088": "text",
    "Spells 1089": "text",
    "Spells 1090": "text",
    "SlotsTotal 25": "text",
    "SlotsRemaining 25": "text",
    "Spells 1091": "text",
    "Spells 1092": "text",
    "Spells 1093": "text",
    "Spells 1094": "text",
    "Spells 1095": "text",
    "Spells 1096": "text",
    "Spells 1097": "text",
    "Spells 1098": "text",
    "Spells 1099": "text",
    "SlotsTotal 26": "text",
    "SlotsRemaining 26": "text",
    "Spells 10100": "text",
    "Spells 10101": "text",
    "Spells 10102": "text",
    "Spells 10103": "text",
    "Check Box 316": "check",
    "Check Box 3042": "check",
    "Check Box 3043": "check",
    "Check Box 3044": "check",
    "Check Box 3045": "check",
    "Check Box 3046": "check",
    "Check Box 3047": "check",
    "Check Box 3048": "check",
    "Check Box 3049": "check",
    "Check Box 3050": "check",
    "Check Box 3051": "check",
    "Check Box 3052": "check",
    "Spells 10104": "text",
    "Check Box 325": "check",
    "Check Box 324": "check",
    "Check Box 3074": "check",
    "Check Box 3075": "check",
    "Check Box 3076": "check",
    "Check Box 3077": "check",
    "Spells 10105": "text",
    "Spells 10106": "text",
    "Check Box 3078": "check",
    "SlotsTotal 27": "text",
    "SlotsRemaining 27": "text",
    "Check Box 313": "check",
    "Check Box 310": "check",
    "Check Box 3020": "check",
    "Check Box 3021": "check",
    "Check Box 3022": "check",
    "Check Box 3023": "check",
    "Check Box 3024": "check",
    "Check Box 3025": "check",
    "Check Box 3026": "check",
    "Check Box 3027": "check",
    "Check Box 3028": "check",
    "Check Box 3029": "check",
    "Check Box 3030": "check",
    "Spells 10107": "text",
    "Spells 10108": "text",
    "Spells 10109": "text",
    "Spells 101010": "text",
    "Spells 101011": "text",
    "Spells 101012": "text",
    "Check Box 319": "check",
    "Check Box 318": "check",
    "Check Box 3053": "check",
    "Check Box 3054": "check",
    "Check Box 3055": "check",
    "Check Box 3056": "check",
    "Check Box 3057": "check",
    "Check Box 3058": "check",
    "Check Box 3059": "check",
    "Check Box 327": "check",
    "Check Box 326": "check",
    "Check Box 3079": "check",
    "Check Box 3080": "check",
    "Check Box 3081": "check",
    "Check Box 3082": "check",
    "Spells 101013": "text",
    "Check Box 3083": "check"
  },
  "fill": [
    {
      "field": "CharacterName",
      "value": "name"
    },
    {
      "field": "CharacterName 2",
      "value": "name"
    },
    {
      "field": "PlayerName",
      "freeform": "player-name"
    },
    {
      "field": "Age",
      "freeform": "appearance.age"
    },
    {